[
  {
    "authority": "HISTORICAL",
    "content": "# AgentGuard Conversational Assistant \u2014 Test Specification",
    "content_sha256": "afca66665d275c6906123d834cb9fb8e75ab407ff2d52f4bdfe8655fd1da9bba",
    "domain": "D_ARCHITECTURE",
    "dynamic_tool_fallback": null,
    "freshness": "VERIFIED",
    "id": "doc_agentguard_chatbot_test_spec_agentguard_conversationa_afca6666",
    "line_end": 2,
    "line_start": 1,
    "relationships": [],
    "route": null,
    "source_path": "docs/AGENTGUARD_CHATBOT_TEST_SPEC.md",
    "source_tier": "TIER_5_SPEC_DOCS",
    "source_type": "DOC",
    "summary": "AgentGuard Conversational Assistant \u2014 Test Specification",
    "symbol": null,
    "tags": [
      "d_architecture",
      "agentguard_chatbot_test_spec"
    ],
    "title": "AGENTGUARD_CHATBOT_TEST_SPEC.md: AgentGuard Conversational Assistant \u2014 Test Specification"
  },
  {
    "authority": "HISTORICAL",
    "content": "## 1. Purpose\n\nThe AgentGuard Conversational Assistant is a specialized conversational security assistant for the AgentGuard Agentic Commerce Firewall.\n\nIts purpose is to allow a judge or user to naturally explore, understand, and interact with the AgentGuard application through conversation.\n\nThe assistant must understand natural human language rather than requiring predefined command syntax.\n\nThe assistant must answer using grounded AgentGuard knowledge and must preserve conversational context across multiple turns.\n\n---",
    "content_sha256": "6f84fcfed20a809fa58a05b80cb383f634bd162fc96bc3b659bebe7a293a8a50",
    "domain": "D_ARCHITECTURE",
    "dynamic_tool_fallback": null,
    "freshness": "VERIFIED",
    "id": "doc_agentguard_chatbot_test_spec_1__purpose_6f84fcfe",
    "line_end": 14,
    "line_start": 3,
    "relationships": [],
    "route": null,
    "source_path": "docs/AGENTGUARD_CHATBOT_TEST_SPEC.md",
    "source_tier": "TIER_5_SPEC_DOCS",
    "source_type": "DOC",
    "summary": "The AgentGuard Conversational Assistant is a specialized conversational security assistant for the AgentGuard Agentic Commerce Firewall.",
    "symbol": null,
    "tags": [
      "d_architecture",
      "agentguard_chatbot_test_spec"
    ],
    "title": "AGENTGUARD_CHATBOT_TEST_SPEC.md: 1. Purpose"
  },
  {
    "authority": "HISTORICAL",
    "content": "# 2. Core AgentGuard Knowledge\n\nAgentGuard is an Agentic Commerce Firewall that establishes a deterministic authorization boundary between autonomous AI shopping agents and financial payment execution.\n\nThe system treats LLM purchase proposals as untrusted claims.\n\nBefore payment execution, AgentGuard independently validates:\n\n- product/catalog price\n- merchant authorization/scope\n- mandate spending limits\n- transaction state\n- replay/idempotency constraints\n- cryptographic audit evidence\n\nThe application uses PostgreSQL as the authoritative operational database.\n\nThe application integrates with Razorpay for payment execution.\n\n---",
    "content_sha256": "3beddfa1a9a45cd6e298cead88f7bff34b91f9fca33bda315bfc357f923f1a98",
    "domain": "D_ARCHITECTURE",
    "dynamic_tool_fallback": null,
    "freshness": "VERIFIED",
    "id": "doc_agentguard_chatbot_test_spec_2__core_agentguard_knowl_3beddfa1",
    "line_end": 35,
    "line_start": 15,
    "relationships": [],
    "route": null,
    "source_path": "docs/AGENTGUARD_CHATBOT_TEST_SPEC.md",
    "source_tier": "TIER_5_SPEC_DOCS",
    "source_type": "DOC",
    "summary": "AgentGuard is an Agentic Commerce Firewall that establishes a deterministic authorization boundary between autonomous AI shopping agents and financial payment execution.",
    "symbol": null,
    "tags": [
      "d_architecture",
      "agentguard_chatbot_test_spec"
    ],
    "title": "AGENTGUARD_CHATBOT_TEST_SPEC.md: 2. Core AgentGuard Knowledge"
  },
  {
    "authority": "HISTORICAL",
    "content": "# 3. Core Conversational Topics\n\nThe assistant must correctly understand and discuss at least:\n\n1. General AgentGuard architecture\n2. Price Tampering\n3. Replay Attacks\n4. Cryptographic Audit Chain\n5. Mandate / Spending Budget\n6. Merchant Authorization / Merchant Scope\n7. Claim Diff\n8. Transaction Execution\n9. Threat Lab\n10. Forensic Ledger\n11. Live Protection\n12. Human Approval / Escalation\n13. Security threat model\n14. Counterfactual scenarios\n\n---",
    "content_sha256": "16bc049caa4345d4b6de58d129cbb66dddd32b3680b1b5e250d6cb2ca8e3cfc7",
    "domain": "D_ARCHITECTURE",
    "dynamic_tool_fallback": null,
    "freshness": "VERIFIED",
    "id": "doc_agentguard_chatbot_test_spec_3__core_conversational_t_16bc049c",
    "line_end": 56,
    "line_start": 36,
    "relationships": [],
    "route": null,
    "source_path": "docs/AGENTGUARD_CHATBOT_TEST_SPEC.md",
    "source_tier": "TIER_5_SPEC_DOCS",
    "source_type": "DOC",
    "summary": "The assistant must correctly understand and discuss at least:",
    "symbol": null,
    "tags": [
      "d_architecture",
      "agentguard_chatbot_test_spec"
    ],
    "title": "AGENTGUARD_CHATBOT_TEST_SPEC.md: 3. Core Conversational Topics"
  },
  {
    "authority": "HISTORICAL",
    "content": "# 4. Supported Communicative Intents\n\nThe assistant must distinguish between:\n\n- Definition\n- Function\n- Why / Value\n- How / Mechanism\n- Example\n- Comparison\n- Counterfactual\n- Code Location\n- UI Navigation\n- Live State\n- Consequence\n- Timing\n- Topic Switch\n- Follow-up Question\n- Clarification\n\nSimilar questions must not automatically receive the same generic answer.\n\nExample:\n\n\"What is AgentGuard?\"\n= definition\n\n\"What does AgentGuard actually do?\"\n= function\n\n\"Why do we need AgentGuard?\"\n= value/problem\n\n\"How does AgentGuard stop price tampering?\"\n= mechanism\n\n\"Give me an example.\"\n= example using current conversational topic\n\n\"Where is that implemented?\"\n= code location using current conversational topic\n\n\"What happens if AgentGuard didn't exist?\"\n= counterfactual\n\n---",
    "content_sha256": "cc63214c67a531fda2f4ad639626685d4254357872e34f52f1369bd3065b8b26",
    "domain": "D_ARCHITECTURE",
    "dynamic_tool_fallback": null,
    "freshness": "VERIFIED",
    "id": "doc_agentguard_chatbot_test_spec_4__supported_communicati_cc63214c",
    "line_end": 103,
    "line_start": 57,
    "relationships": [],
    "route": null,
    "source_path": "docs/AGENTGUARD_CHATBOT_TEST_SPEC.md",
    "source_tier": "TIER_5_SPEC_DOCS",
    "source_type": "DOC",
    "summary": "The assistant must distinguish between:",
    "symbol": null,
    "tags": [
      "d_architecture",
      "agentguard_chatbot_test_spec"
    ],
    "title": "AGENTGUARD_CHATBOT_TEST_SPEC.md: 4. Supported Communicative Intents"
  },
  {
    "authority": "HISTORICAL",
    "content": "# 5. Multi-Turn Context Requirement\n\nThe assistant MUST preserve the active topic across turns.\n\nExample:\n\nUser:\n\"Tell me about price tampering.\"\n\nAssistant:\n[explains price tampering]\n\nUser:\n\"Why is that dangerous?\"\n\nThe assistant must interpret \"that\" as price tampering.\n\nUser:\n\"How does AgentGuard stop it?\"\n\n\"It\" must refer to price tampering.\n\nUser:\n\"Give me an example.\"\n\nThe example must be about price tampering.\n\nUser:\n\"Where is that implemented?\"\n\n\"That\" must refer to the relevant price-tampering protection.\n\nThe assistant must NOT suddenly return to a generic AgentGuard definition.\n\n---",
    "content_sha256": "31355319107199fbb7000d6ea0bff266de8595ec27e4cb16787933c7b6429717",
    "domain": "D_ARCHITECTURE",
    "dynamic_tool_fallback": null,
    "freshness": "VERIFIED",
    "id": "doc_agentguard_chatbot_test_spec_5__multi_turn_context_re_31355319",
    "line_end": 139,
    "line_start": 104,
    "relationships": [],
    "route": null,
    "source_path": "docs/AGENTGUARD_CHATBOT_TEST_SPEC.md",
    "source_tier": "TIER_5_SPEC_DOCS",
    "source_type": "DOC",
    "summary": "The assistant MUST preserve the active topic across turns.",
    "symbol": null,
    "tags": [
      "d_architecture",
      "agentguard_chatbot_test_spec"
    ],
    "title": "AGENTGUARD_CHATBOT_TEST_SPEC.md: 5. Multi-Turn Context Requirement"
  },
  {
    "authority": "HISTORICAL",
    "content": "# 6. Coreference Resolution\n\nTest natural references including:\n\n- it\n- that\n- this\n- this check\n- that protection\n- the previous thing\n- the attack\n- the transaction\n- the price\n- that problem\n- the mechanism\n- the check\n\nThe assistant must resolve these using conversational context.\n\n---",
    "content_sha256": "2185ae3a3515df1735d04754c8dd25a023a36c56f6dfd3d1ff63db2e03329c33",
    "domain": "D_ARCHITECTURE",
    "dynamic_tool_fallback": null,
    "freshness": "VERIFIED",
    "id": "doc_agentguard_chatbot_test_spec_6__coreference_resolutio_2185ae3a",
    "line_end": 160,
    "line_start": 140,
    "relationships": [],
    "route": null,
    "source_path": "docs/AGENTGUARD_CHATBOT_TEST_SPEC.md",
    "source_tier": "TIER_5_SPEC_DOCS",
    "source_type": "DOC",
    "summary": "Test natural references including:",
    "symbol": null,
    "tags": [
      "d_architecture",
      "agentguard_chatbot_test_spec"
    ],
    "title": "AGENTGUARD_CHATBOT_TEST_SPEC.md: 6. Coreference Resolution"
  },
  {
    "authority": "HISTORICAL",
    "content": "# 7. Topic Switching\n\nThe assistant must support natural topic changes.\n\nExample:\n\nUser:\n\"Tell me about price tampering.\"\n\nUser:\n\"Actually forget that. Tell me about replay attacks.\"\n\nThe assistant must switch to replay attacks.\n\nThen:\n\n\"Okay, now explain the audit chain.\"\n\nThe assistant must switch to audit-chain context.\n\nThen:\n\n\"Go back to price tampering.\"\n\nThe assistant must return to price-tampering context.\n\n---",
    "content_sha256": "ca7480d695e4df76d9584b6c7e48c8f4df10c8bbd463ecb4f24026d72d6bed2b",
    "domain": "D_ARCHITECTURE",
    "dynamic_tool_fallback": null,
    "freshness": "VERIFIED",